{
  "scenario_id": "SCN-DEV-POL02-06",
  "configuration_context": {
    "pol03_enabled": false
  },
  "policy_id": "POL-02_GRADED_SCAFFOLD",
  "policy_version": "0.1.0",
  "timestamp": "2026-08-24T18:15:00Z",
  "system_response": "Ecco come possiamo strutturare l'avvio della sessione: 1. Delimitiamo il materiale tra quelli che hai dichiarato (slide di Algoritmi capitolo 2); 2. Scegliamo un singolo blocco di lavoro; 3. Definisci tu la prima micro-azione con cui vuoi iniziare. Da quale blocco preferisci partire?",
  "decision_trace": [
    {
      "source": "POL-02",
      "event": "CHECK_APPLICABILITY",
      "details": "CHECK_APPLICABILITY: User requested maximum process structure while POL-03 is OFF"
    },
    {
      "source": "POL-02",
      "event": "ASSESS_SIGNAL",
      "details": "ASSESS_SIGNAL: MORE_HELP_REQUESTED"
    },
    {
      "source": "POL-02",
      "event": "SELECT_LEVEL",
      "details": "SELECT_LEVEL: Level 3 (Maximum Process Structure)"
    },
    {
      "source": "POL-02",
      "event": "TRANSITION",
      "details": "TRANSITION: ESCALATE from 2 to 3"
    },
    {
      "source": "POL-02",
      "event": "DELEGATION_CHECK",
      "details": "DELEGATION_CHECK: POL-03 is OFF in this configuration -> No delegation requested"
    },
    {
      "source": "POL-02",
      "event": "APPLY_MOVE",
      "details": "APPLY_MOVE: PROVIDE_PROCESS_STRUCTURE without creating action_record and without inventing concrete actions"
    },
    {
      "source": "POL-02",
      "event": "RECORD_STATE",
      "details": "RECORD_STATE: scaffold_level=3, pol03_delegation_requested=false, stop_status=ACTIVE"
    }
  ],
  "policy_activated": true,
  "non_activation_reason": null,
  "level_before": 2,
  "level_after": 3,
  "transition": "ESCALATE",
  "transition_reason": "USER_REQUESTED_MORE_STRUCTURE",
  "user_signal": "MORE_HELP_REQUESTED",
  "support_move": "PROVIDE_PROCESS_STRUCTURE",
  "orientation_question": null,
  "declared_options_used": [],
  "process_structure": "Struttura procedurale astratta: delimitazione materiale dichiarato, scelta unita di lavoro, invito all'utente a formulare la propria azione.",
  "grounded_facts_used": [
    "capitolo 2",
    "slide di Algoritmi"
  ],
  "pol03_delegation_requested": false,
  "scaffold_state": {
    "scaffold_version": 3,
    "current_level": 3,
    "previous_level": 2,
    "transition": "ESCALATE",
    "transition_reason": "USER_REQUESTED_MORE_STRUCTURE",
    "user_signal": "MORE_HELP_REQUESTED",
    "support_move": "PROVIDE_PROCESS_STRUCTURE",
    "grounded_facts": [
      "capitolo 2",
      "slide di Algoritmi"
    ],
    "pol03_delegation_requested": false,
    "stop_status": "ACTIVE",
    "created_at_turn": 1,
    "updated_at_turn": 3
  },
  "turn_status": "SUPPORT_DELIVERED",
  "safety_violations": []
}
