{
  "scenario_id": "SCN-DEV-POL02-01",
  "policy_id": "POL-02_GRADED_SCAFFOLD",
  "policy_version": "0.1.0",
  "timestamp": "2026-08-24T18:00:00Z",
  "system_response": "Ottimo, hai le idee chiare per cominciare. Se piu tardi ti serve un supporto organizzativo, fammi sapere.",
  "decision_trace": [
    {
      "source": "POL-02",
      "event": "CHECK_APPLICABILITY",
      "details": "CHECK_APPLICABILITY: User expressed clear autonomous starting choice with complete plan"
    },
    {
      "source": "POL-02",
      "event": "ASSESS_SIGNAL",
      "details": "ASSESS_SIGNAL: NO_ASSISTANCE_REQUESTED"
    },
    {
      "source": "POL-02",
      "event": "DEACTIVATE_POLICY",
      "details": "DEACTIVATE_POLICY: POL-02 is NOT_APPLICABLE when user already has an autonomous plan"
    },
    {
      "source": "POL-02",
      "event": "NO_POLICY_MOVE",
      "details": "NO_POLICY_MOVE: Autonomy respected without procedural intervention"
    },
    {
      "source": "POL-02",
      "event": "RECORD_STATE",
      "details": "RECORD_STATE: scaffold_level=0, stop_status=ACTIVE"
    }
  ],
  "policy_activated": false,
  "non_activation_reason": "USER_ALREADY_AUTONOMOUS_WITH_CLEAR_PLAN",
  "level_before": null,
  "level_after": 0,
  "transition": "NOT_APPLICABLE",
  "transition_reason": "USER_ALREADY_AUTONOMOUS_PLAN",
  "user_signal": "NO_ASSISTANCE_REQUESTED",
  "support_move": "NONE",
  "orientation_question": null,
  "declared_options_used": [],
  "process_structure": null,
  "grounded_facts_used": [
    "Sistemi Operativi",
    "capitolo 3"
  ],
  "pol03_delegation_requested": false,
  "scaffold_state": {
    "scaffold_version": 1,
    "current_level": 0,
    "previous_level": null,
    "transition": "NOT_APPLICABLE",
    "transition_reason": "USER_ALREADY_AUTONOMOUS_PLAN",
    "user_signal": "NO_ASSISTANCE_REQUESTED",
    "support_move": "NONE",
    "grounded_facts": [
      "Sistemi Operativi",
      "capitolo 3"
    ],
    "pol03_delegation_requested": false,
    "stop_status": "ACTIVE",
    "created_at_turn": 1,
    "updated_at_turn": 1
  },
  "turn_status": "NOT_APPLICABLE",
  "safety_violations": []
}
