{
  "scenario_id": "SCN-DEV-POL02-04",
  "policy_id": "POL-02_GRADED_SCAFFOLD",
  "policy_version": "0.1.0",
  "timestamp": "2026-08-24T18:10:00Z",
  "system_response": "Visto che hai a disposizione sia gli appunti delle lezioni che gli esercizi svolti, puoi scegliere in base a cosa ti richiede meno attrito: partire rileggendo gli appunti o provare subito il primo esercizio. Quale delle due opzioni preferisci?",
  "decision_trace": [
    {
      "source": "POL-02",
      "event": "CHECK_APPLICABILITY",
      "details": "CHECK_APPLICABILITY: User undecided between declared options (appunti vs esercizi)"
    },
    {
      "source": "POL-02",
      "event": "ASSESS_SIGNAL",
      "details": "ASSESS_SIGNAL: PERSISTENT_STALL"
    },
    {
      "source": "POL-02",
      "event": "SELECT_LEVEL",
      "details": "SELECT_LEVEL: Level 2 (Declared Options / Selection Criterion)"
    },
    {
      "source": "POL-02",
      "event": "TRANSITION",
      "details": "TRANSITION: ESCALATE from 1 to 2"
    },
    {
      "source": "POL-02",
      "event": "APPLY_MOVE",
      "details": "APPLY_MOVE: OFFER_DECLARED_OPTIONS with max 2 options grounded on user facts"
    },
    {
      "source": "POL-02",
      "event": "RECORD_STATE",
      "details": "RECORD_STATE: scaffold_level=2, stop_status=ACTIVE"
    }
  ],
  "policy_activated": true,
  "non_activation_reason": null,
  "level_before": 1,
  "level_after": 2,
  "transition": "ESCALATE",
  "transition_reason": "USER_DECLARED_PERSISTENT_STALL",
  "user_signal": "PERSISTENT_STALL",
  "support_move": "OFFER_DECLARED_OPTIONS",
  "orientation_question": null,
  "declared_options_used": [
    "appunti delle lezioni",
    "esercizi svolti"
  ],
  "process_structure": "Scegliere in base al minor attrito tra revisione concettuale o pratica immediata.",
  "grounded_facts_used": [
    "appunti delle lezioni",
    "esercizi svolti",
    "Reti di Calcolatori"
  ],
  "pol03_delegation_requested": false,
  "scaffold_state": {
    "scaffold_version": 2,
    "current_level": 2,
    "previous_level": 1,
    "transition": "ESCALATE",
    "transition_reason": "USER_DECLARED_PERSISTENT_STALL",
    "user_signal": "PERSISTENT_STALL",
    "support_move": "OFFER_DECLARED_OPTIONS",
    "grounded_facts": [
      "appunti delle lezioni",
      "esercizi svolti",
      "Reti di Calcolatori"
    ],
    "pol03_delegation_requested": false,
    "stop_status": "ACTIVE",
    "created_at_turn": 1,
    "updated_at_turn": 2
  },
  "turn_status": "SUPPORT_DELIVERED",
  "safety_violations": []
}
